{
  "run_id": "run-2026-09-10-0001",
  "trace_id": "trace-8f2c1a",
  "generated_at": "2026-09-10T14:22:31Z",
  "trigger": "manual",
  "app_type": "traditional",
  "fixture_id": "bug-001-implementation-bug",
  "status": "completed",
  "budget": {
    "max_steps": 50,
    "max_llm_calls": 30,
    "max_runtime_seconds": 600,
    "max_test_cases": 100,
    "max_retries": 3,
    "max_cost_usd": 2.0,
    "used": {
      "steps": 18,
      "llm_calls": 11,
      "runtime_seconds": 74.2,
      "test_cases": 12,
      "retries": 0,
      "cost_usd": 0.43
    }
  },
  "findings": [
    {
      "id": "IMPL-001",
      "app_type": "traditional",
      "location": {
        "category": "application",
        "component": "pagination",
        "path": "app/pagination.py",
        "symbol": "page_count",
        "lines": [10]
      },
      "concerns": ["correctness"],
      "classification": { "type": "implementation_bug" },
      "evidence": [
        "generated test_page_count_partial_page failed: page_count(10, 3) returned 3, expected 4",
        "generated test_last_page_unreachable failed: has_next_page(10, 3, 3) returned False while slice_page(items, 4, 3) returns [9]"
      ],
      "hypotheses": [
        "page_count truncates the partial final page, so has_next_page hides a page that slice_page would serve"
      ],
      "investigations": [
        "reran with total_items in {10, 11, 13} and per_page=3; every non-multiple undercounted by exactly one page",
        "confirmed multiples of per_page (9, 12) are unaffected, which is why the existing suite passes"
      ],
      "root_cause": {
        "status": "confirmed",
        "explanation": "page_count uses floor division, so any remainder is truncated and the partial final page is never counted; has_next_page inherits the error and makes those items unreachable"
      },
      "severity": "P2",
      "confidence": 1.0,
      "verification": { "status": "reproduced" }
    }
  ],
  "diff_summary": {
    "new": ["IMPL-001"],
    "known": [],
    "regression": [],
    "resolved": []
  }
}
